<People xmlns:xsi="http://www.w3.org/2001/XMLSchema-instance"
xmlns="http://www.myws.com/"
xsi:schemaLocation="http://www.myws.com/ People.xsd">
	<Person>
		<name>Peter</name>
		<id>abc345</id>
		<salary>1189.34</salary>
	</Person>
	<Person>
		<name>Anne</name>
		<id>abd345</id>
		<salary>189.12</salary>
	</Person>
	<Person male="test">
		<name>Ken</name>
		<id>abe545</id>
		<salary>89.12</salary>
	</Person>
	<Person>
		<name>Sue</name>
		<id>abf345</id>
		<salary>89.34</salary>
	</Person>
	<love>test</love>
	<test/>
	<badlove person="peter" action="beat">test</badlove>
	<att attr="test"/>
</People>

